{
  "schema_version": 1,
  "repo": "salesforce-lite-crm",
  "mode": "FailSafe",
  "tasks": [
    {
      "id": "S4-F1",
      "title": "Demo seed tuning",
      "status": "queued",
      "risk": "medium",
      "priority": 100,
      "allowed_zones": ["prisma/seed.ts", "lib/server/**", "lib/db/**", "lib/routing/**", "lib/forecast/**"],
      "preferred_agents": ["codex"],
      "fallback_agents": ["claude", "gemini"],
      "review_agents": ["grok"],
      "parallel_safe": true,
      "prompt_template": "prompts/shared/s4-f1-codex-demo-seed-tuning.md",
      "gate": ["npx prisma generate", "npx prisma db push", "npm run seed", "npm run lint", "npm run test", "npm run build"],
      "max_worker_attempts": 3
    },
    {
      "id": "S4-F2",
      "title": "Route visual QA",
      "status": "queued",
      "risk": "medium",
      "priority": 90,
      "allowed_zones": ["app/**"],
      "preferred_agents": ["claude"],
      "fallback_agents": ["grok", "codex"],
      "review_agents": ["gemini"],
      "parallel_safe": true,
      "prompt_template": "prompts/shared/s4-f2-claude-route-visual-qa.md",
      "gate": ["npm run build", "npm run lint", "npm run test:e2e"],
      "max_worker_attempts": 3
    },
    {
      "id": "S4-F3",
      "title": "Component polish",
      "status": "queued",
      "risk": "low",
      "priority": 80,
      "allowed_zones": ["components/**", "app/globals.css", "tailwind.config.ts"],
      "preferred_agents": ["grok"],
      "fallback_agents": ["claude", "gemini"],
      "review_agents": ["codex"],
      "parallel_safe": true,
      "prompt_template": "prompts/shared/s4-f3-grok-component-polish.md",
      "gate": ["npm run build", "npm run lint", "npm run test:e2e"],
      "max_worker_attempts": 3
    },
    {
      "id": "S4-F4",
      "title": "Demo smoke and gate hardening",
      "status": "queued",
      "risk": "medium",
      "priority": 70,
      "allowed_zones": ["tests/**", "e2e/**", "scripts/**", "playwright.config.ts", "vitest.config.ts"],
      "preferred_agents": ["gemini"],
      "fallback_agents": ["codex", "claude"],
      "review_agents": ["grok"],
      "parallel_safe": false,
      "prompt_template": "prompts/shared/s4-f4-gemini-demo-smoke-gate.md",
      "gate": ["npm run seed", "npm run lint", "npm run build", "npx playwright install chromium", "npm run test:e2e"],
      "max_worker_attempts": 3
    }
  ]
}
